{
  "schema_version": "1.0.0",
  "id": "E-028-CT-O1-CT-O2",
  "from": "CT-O1",
  "to": "CT-O2",
  "relation": "optional",
  "constraint": "start",
  "blocking": "hard",
  "rationale": "Actual runtime context rewrite follows logical isolation and runtime capability.",
  "provenance": "documented_planned",
  "source_refs": [
    {
      "path": "docs/AgentGuard_Context_Isolation_Taint_Tracking_Final_RC/08_实施拆PR与三轨并行计划.md",
      "heading": "# 20. 推荐迭代顺序",
      "line_hint": 509
    }
  ],
  "decision_id": null
}
