{
  "schema_version": "1.0.0",
  "id": "E-112-S3-S3PLUS",
  "from": "S3",
  "to": "S3PLUS",
  "relation": "optional",
  "constraint": "start",
  "blocking": "hard",
  "rationale": "S3PLUS requires S3.",
  "provenance": "documented_planned",
  "source_refs": [
    {
      "path": "docs/AgentGuard_Runtime_Supervision_Console_Design/04_三线阶段实施_PR拆分与验收.md",
      "heading": "## 4. 推荐依赖主线",
      "line_hint": 117
    }
  ],
  "decision_id": null
}
