{
  "schema_version": "1.0.0",
  "id": "E-A-RTEP0-15-RTE-P0-DOD",
  "from": "A-RTEP0-15",
  "to": "RTE-P0-DOD",
  "relation": "qualifies",
  "constraint": "exit",
  "blocking": "hard",
  "rationale": "RTE-P0-DOD cannot exit until this documented acceptance item is verified.",
  "provenance": "documented_git_confirmed",
  "source_refs": [
    {
      "path": "docs/AgentGuard_Runtime_Enforcement_Contract_v1_Final/06_迁移_PR与实施计划.md",
      "heading": "## 13. P0 完成定义",
      "line_hint": 326
    }
  ],
  "decision_id": null
}
