{
  "schema_version": "1.0.0",
  "id": "E-022-CT03A-CT03B",
  "from": "CT03A",
  "to": "CT03B",
  "relation": "hard_dependency",
  "constraint": "start",
  "blocking": "hard",
  "rationale": "CT03B requires CT03A.",
  "provenance": "documented_git_confirmed",
  "source_refs": [
    {
      "path": "docs/AgentGuard_Context_Isolation_Taint_Tracking_Final_RC/08_实施拆PR与三轨并行计划.md",
      "heading": "# 20. 推荐迭代顺序",
      "line_hint": 509
    }
  ],
  "decision_id": null
}
