{
  "schema_version": "1.0.0",
  "id": "E-A-GSEM-04-G-SEM",
  "from": "A-GSEM-04",
  "to": "G-SEM",
  "relation": "qualifies",
  "constraint": "exit",
  "blocking": "hard",
  "rationale": "G-SEM cannot exit until this documented acceptance item is verified.",
  "provenance": "documented_planned",
  "source_refs": [
    {
      "path": "docs/AgentGuard_Core_V2.1_Final_Contract_Freeze/04_兼容迁移与实施计划.md",
      "heading": "## 20. V21-14 — Optional Semantic Upgrade-only",
      "line_hint": 512
    }
  ],
  "decision_id": null
}
