{
  "schema_version": "1.0.0",
  "id": "E-082-C12-G-PR12",
  "from": "C12",
  "to": "G-PR12",
  "relation": "qualifies",
  "constraint": "exit",
  "blocking": "hard",
  "rationale": "G-PR12 requires C12.",
  "provenance": "documented_planned",
  "source_refs": [
    {
      "path": "docs/AgentGuard_Core_V2.1_Final_Contract_Freeze/04_兼容迁移与实施计划.md",
      "heading": "## 5. 15 Phase 最终实施 DAG",
      "line_hint": 136
    }
  ],
  "decision_id": null
}
