{
  "schema_version": "1.0.0",
  "id": "E-A-S2-06-S2",
  "from": "A-S2-06",
  "to": "S2",
  "relation": "qualifies",
  "constraint": "exit",
  "blocking": "hard",
  "rationale": "S2 cannot exit until this documented acceptance item is verified.",
  "provenance": "documented_planned",
  "source_refs": [
    {
      "path": "docs/AgentGuard_Runtime_Supervision_Console_Design/04_三线阶段实施_PR拆分与验收.md",
      "heading": "### 8.3 退出条件",
      "line_hint": 389
    }
  ],
  "decision_id": null
}
