{
  "schema_version": "1.0.0",
  "id": "E-034-RSC-CT01-I01",
  "from": "RSC-CT01",
  "to": "I01",
  "relation": "hard_dependency",
  "constraint": "start",
  "blocking": "hard",
  "rationale": "I01 requires RSC-CT01.",
  "provenance": "documented_planned",
  "source_refs": [
    {
      "path": "docs/AgentGuard_Runtime_Supervision_Console_Design/04_三线阶段实施_PR拆分与验收.md",
      "heading": "## 4. 推荐依赖主线",
      "line_hint": 117
    }
  ],
  "decision_id": null
}
