{
  "schema_version": "1.0.0",
  "id": "E-039-R01-R02",
  "from": "R01",
  "to": "R02",
  "relation": "hard_dependency",
  "constraint": "start",
  "blocking": "hard",
  "rationale": "R02 requires R01.",
  "provenance": "documented_git_confirmed",
  "source_refs": [
    {
      "path": "docs/AgentGuard_Runtime_Enforcement_Contract_v1_Final/06_迁移_PR与实施计划.md",
      "heading": "## 11. 并行开发关系",
      "line_hint": 251
    }
  ],
  "decision_id": null
}
