{
  "schema_version": "1.0.0",
  "id": "E-119-FE08-S4",
  "from": "FE08",
  "to": "S4",
  "relation": "join",
  "constraint": "exit",
  "blocking": "hard",
  "rationale": "S4 requires FE08.",
  "provenance": "documented_planned",
  "source_refs": [
    {
      "path": "docs/AgentGuard_Runtime_Supervision_Console_Design/04_三线阶段实施_PR拆分与验收.md",
      "heading": "## 4. 推荐依赖主线",
      "line_hint": 117
    }
  ],
  "decision_id": null
}
