{
  "schema_version": "1.0.0",
  "id": "E-036-I01-G-A",
  "from": "I01",
  "to": "G-A",
  "relation": "qualifies",
  "constraint": "exit",
  "blocking": "hard",
  "rationale": "Gate A requires production Snapshot to V2 shadow integration.",
  "provenance": "documented_planned",
  "source_refs": [
    {
      "path": "docs/AgentGuard_Runtime_Supervision_Console_Design/04_三线阶段实施_PR拆分与验收.md",
      "heading": "## 5. Gate A / Gate B 边界",
      "line_hint": 203
    }
  ],
  "decision_id": null
}
