{
  "schema_version": "1.0.0",
  "id": "E-085-G-ENG-G-CLAIM",
  "from": "G-ENG",
  "to": "G-CLAIM",
  "relation": "qualifies",
  "constraint": "exit",
  "blocking": "hard",
  "rationale": "G-CLAIM requires G-ENG.",
  "provenance": "documented_planned",
  "source_refs": [
    {
      "path": "docs/AgentGuard_V2.1_Master_Roadmap_Final_Freeze_v2.md",
      "heading": "# 3. 全局实施 DAG",
      "line_hint": 79
    }
  ],
  "decision_id": null
}
